{
  "@id": "https://doi.org/10.3535/XXX-XXX-XXX",
  "@type": "ods:DigitalMedia",
  "dcterms:identifier": "https://doi.org/10.3535/XXX-XXX-XXX",
  "ods:fdoType": "https://doi.org/21.T11148/bbad8c4e101e8af01115",
  "ods:version": 1,
  "dcterms:created": "2023-10-02T12:31:34.806Z",
  "dcterms:modified": "2023-10-02T12:31:34.806Z",
  "ac:accessURI": "https://image.bgbm.org/images/internal/HerbarThumbs/B100272813_1700",
  "ods:sourceSystemID": "https://hdl.handle.net/20.5000.1025/XXX-XXX-XXX",
  "ods:sourceSystemName": "Naturalis Biodiversity Center (NL) - Vermes",
  "dcterms:type": "Image",
  "ods:status": "Tombstone",
  "dcterms:format": "image/jpeg",
  "dcterms:title": "Image of a botanical sheet with label",
  "dcterms:description": "Image of a botanical sheet with label",
  "dcterms:rights": "https://creativecommons.org/licenses/by/4.0/",
  "xmpRights:Owner": "Naturalis Biodiversity Center",
  "dcterms:available": "2023-10-01",
  "ac:comments": "This is a test object",
  "dcterms:source": "http://biocol.org/institution/australian-national-insect-collection",
  "Iptc4xmpExt:CVterm": "http://rs.tdwg.org/accontent/values/c000",
  "ac:subjectCategoryVocabulary": "http://rs.tdwg.org/accontent/values",
  "ac:variant": "http://rs.tdwg.org/acvariant/values/v001",
  "ac:variantLiteral": "Thumbnail",
  "ac:variantDescription": "Video shortened instead of simply quality reduced",
  "exif:PixelYDimension": 1080,
  "exif:PixelXDimension": 1920,
  "ac:tag": [
    "Herbarium",
    "Botany",
    "Leaf"
  ],
  "xmp:CreateDate": "2023-10-01T12:31:34.806Z",
  "ac:timeOfDay": "afternoon",
  "ac:subjectOrientation": "http://rs.tdwg.org/acorient/values/r0002",
  "ac:subjectOrientationLiteral": "posterior side",
  "ac:subjectPart": "http://rs.tdwg.org/acpart/values/p0027",
  "ac:subjectPartLiteral": "skull",
  "ac:captureDevice": "Canon EOS 5D Mark IV",
  "ac:digitizationDate": "2023-10-01",
  "ac:frameRate": 60,
  "ac:resourceCreationTechnique": "Media may have been manipulated to improve appearance",
  "ods:hasAssertions": [
    {
      "@type": "ods:Assertion",
      "dwc:measurementType": "size",
      "dwc:measurementDeterminedDate": "2024-05-30T15:16:00.000Z",
      "dwc:measurementValue": "10.0",
      "dwc:measurementAccuracy": "0.1",
      "dwc:measurementUnit": "MB",
      "ods:hasAgents": [
        {
          "@id": "https://orcid.org/0000-0002-5669-2769",
          "@type": "schema:Person",
          "schema:identifier": "https://orcid.org/0000-0002-5669-2769",
          "schema:name": "Sam Leeflang",
          "ods:hasRoles": [
            {
              "@type": "schema:Role",
              "schema:roleName": "measurer",
              "schema:startDate": "2023-10-02T12:31:34.806Z",
              "schema:endDate": "2023-12-02T12:31:34.806Z"
            }
          ],
          "ods:hasIdentifiers": [
            {
              "@id": "https://orcid.org/0000-0002-5669-2769",
              "@type": "ods:Identifier",
              "dcterms:title": "ORCID",
              "dcterms:type": "URL",
              "dcterms:identifier": "https://orcid.org/0000-0002-5669-2769",
              "ods:isPartOfLabel": false,
              "ods:gupriLevel": "GloballyUniqueStablePersistentResolvable",
              "ods:identifierStatus": "Preferred"
            }
          ]
        }
      ]
    }
  ],
  "ods:hasCitations": [
    {
      "@id": "http://doi.org/10.3897/zookeys.107.1608",
      "@type": "ods:Citation",
      "dcterms:identifier": "http://doi.org/10.3897/zookeys.107.1608",
      "dcterms:type": "Journal Article",
      "dcterms:date": "2020-08-15",
      "dcterms:title": "Description d’Athous (Orthathous) chassaini n. sp., espèce nouvelle du Sud de la France (Coleoptera Elateridae Denticollinae)",
      "ods:pageNumber": "369-373.",
      "dcterms:description": "New species",
      "dcterms:bibliographicCitation": "Platia G. & Van Meer C., 2020 - Description d’Athous (Orthathous) chassaini n. sp., espèce nouvelle du Sud de la France (Coleoptera Elateridae Denticollinae). L'Entomologiste, 76 (6) : 369-373.",
      "ods:isPeerReviewed": true,
      "ods:hasAgents": [
        {
          "@id": "https://orcid.org/0009-0004-8647-4502",
          "@type": "schema:Person",
          "schema:identifier": "https://orcid.org/0009-0004-8647-4502",
          "schema:name": "Platia G.",
          "ods:hasRoles": [
            {
              "@type": "schema:Role",
              "schema:roleName": "author",
              "schema:position": 1
            }
          ],
          "ods:hasIdentifiers": [
            {
              "@id": "https://orcid.org/0009-0004-8647-4502",
              "@type": "ods:Identifier",
              "dcterms:title": "ORCID",
              "dcterms:type": "URL",
              "dcterms:identifier": "https://orcid.org/0009-0004-8647-4502",
              "ods:isPartOfLabel": false,
              "ods:gupriLevel": "GloballyUniqueStablePersistentResolvable",
              "ods:identifierStatus": "Preferred"
            },
            {
              "@id": "https://m.wikidata.org/wiki/Q18818845",
              "@type": "ods:Identifier",
              "dcterms:title": "wikidata",
              "dcterms:type": "URL",
              "dcterms:identifier": "https://m.wikidata.org/wiki/Q18818845",
              "ods:isPartOfLabel": false,
              "ods:gupriLevel": "GloballyUniqueStablePersistentResolvable",
              "ods:identifierStatus": "Preferred"
            }
          ]
        },
        {
          "@type": "schema:Person",
          "schema:name": "Van Meer C",
          "ods:hasRoles": [
            {
              "@type": "schema:Role",
              "schema:roleName": "author",
              "schema:position": 2
            }
          ]
        }
      ]
    }
  ],
  "ods:hasIdentifiers": [
    {
      "@id": "ZMA.VER.207014@CRS",
      "@type": "ods:Identifier",
      "dcterms:title": "dwca:ID",
      "dcterms:type": "Locally unique identifier",
      "dcterms:identifier": "ZMA.VER.207014@CRS",
      "ods:isPartOfLabel": false,
      "ods:gupriLevel": "LocallyUniqueStable"
    },
    {
      "@id": "https://medialib.naturalis.nl/file/id/ZMA.VER.207014/format/large",
      "@type": "ods:Identifier",
      "dcterms:title": "dcterms:identifier",
      "dcterms:type": "PURL",
      "dcterms:identifier": "https://medialib.naturalis.nl/file/id/ZMA.VER.207014/format/large",
      "ods:isPartOfLabel": false,
      "ods:gupriLevel": "GloballyUniqueStableResolvable"
    }
  ],
  "ods:hasEntityRelationships": [
    {
      "@type": "ods:EntityRelationship",
      "dwc:relationshipOfResource": "hasUrl",
      "dwc:relatedResourceURI": "https://medialib.naturalis.nl/file/id/ZMA.VER.207014/format/large",
      "dwc:relationshipEstablishedDate": "2024-09-06T13:01:15.783Z",
      "ods:hasAgents": [
        {
          "@id": "https://hdl.handle.net/TEST/XXX-XXX-XXX",
          "@type": "schema:SoftwareApplication",
          "schema:identifier": "https://hdl.handle.net/TEST/XXX-XXX-XXX",
          "schema:name": "DiSSCo Translator Service",
          "ods:hasRoles": [
            {
              "@type": "schema:Role",
              "schema:roleName": "processing service",
              "schema:startDate": "2023-10-02T12:31:34.806Z"
            }
          ],
          "ods:hasIdentifiers": [
            {
              "@id": "https://hdl.handle.net/TEST/XXX-XXX-XXX",
              "@type": "ods:Identifier",
              "dcterms:title": "handle",
              "dcterms:type": "Handle",
              "dcterms:identifier": "https://hdl.handle.net/TEST/XXX-XXX-XXX",
              "ods:isPartOfLabel": false,
              "ods:gupriLevel": "GloballyUniqueStablePersistentResolvableFDOCompliant",
              "ods:identifierStatus": "Preferred"
            }
          ]
        }
      ]
    },
    {
      "@type": "ods:EntityRelationship",
      "dwc:relationshipOfResource": "hasOrganisationID",
      "dwc:relatedResourceID": "0566bfb96",
      "dwc:relatedResourceURI": "https://ror.org/0566bfb96",
      "dwc:relationshipEstablishedDate": "2024-09-06T13:01:15.783Z",
      "ods:hasAgents": [
        {
          "@id": "https://hdl.handle.net/TEST/XXX-XXX-XXX",
          "@type": "schema:SoftwareApplication",
          "schema:identifier": "https://hdl.handle.net/TEST/XXX-XXX-XXX",
          "schema:name": "DiSSCo Translator Service",
          "ods:hasRoles": [
            {
              "@type": "schema:Role",
              "schema:roleName": "processing service",
              "schema:startDate": "2023-10-02T12:31:34.806Z"
            }
          ],
          "ods:hasIdentifiers": [
            {
              "@id": "https://hdl.handle.net/TEST/XXX-XXX-XXX",
              "@type": "ods:Identifier",
              "dcterms:title": "handle",
              "dcterms:type": "Handle",
              "dcterms:identifier": "https://hdl.handle.net/TEST/XXX-XXX-XXX",
              "ods:isPartOfLabel": false,
              "ods:gupriLevel": "GloballyUniqueStablePersistentResolvableFDOCompliant",
              "ods:identifierStatus": "Preferred"
            }
          ]
        }
      ]
    },
    {
      "@type": "ods:EntityRelationship",
      "dwc:relationshipOfResource": "hasFdoType",
      "dwc:relatedResourceID": "21.T11148/bbad8c4e101e8af01115",
      "dwc:relatedResourceURI": "https://doi.org/21.T11148/bbad8c4e101e8af01115",
      "dwc:relationshipEstablishedDate": "2024-09-06T13:01:15.783Z",
      "ods:hasAgents": [
        {
          "@id": "https://hdl.handle.net/TEST/XXX-XXX-XXX",
          "@type": "schema:SoftwareApplication",
          "schema:identifier": "https://hdl.handle.net/TEST/XXX-XXX-XXX",
          "schema:name": "DiSSCo Translator Service",
          "ods:hasRoles": [
            {
              "@type": "schema:Role",
              "schema:roleName": "processing service",
              "schema:startDate": "2023-10-02T12:31:34.806Z"
            }
          ],